id,title,slug,difficulty,paid_only
3571,Length of the Longest Increasing Path,length-of-the-longest-increasing-path,Hard,False
3563,Select Cells in Grid With Maximum Score,select-cells-in-grid-with-maximum-score,Hard,False
3562,Maximum Score of Non-overlapping Intervals,maximum-score-of-non-overlapping-intervals,Hard,False
3560,Maximum Number of Moves to Kill All Pawns,maximum-number-of-moves-to-kill-all-pawns,Hard,False
3557,Minimum Number of Valid Strings to Form Target II,minimum-number-of-valid-strings-to-form-target-ii,Hard,False
3556,Final Array State After K Multiplication Operations II,final-array-state-after-k-multiplication-operations-ii,Hard,False
3552,Find the Largest Palindrome Divisible by K,find-the-largest-palindrome-divisible-by-k,Hard,False
3551,Maximum XOR Score Subarray Queries,maximum-xor-score-subarray-queries,Hard,False
3550,Maximum Value Sum by Placing Three Rooks I,maximum-value-sum-by-placing-three-rooks-i,Hard,False
3548,Find the Count of Good Integers,find-the-count-of-good-integers,Hard,False
3546,Count Substrings That Satisfy K-Constraint II,count-substrings-that-satisfy-k-constraint-ii,Hard,False
3544,Count Almost Equal Pairs II,count-almost-equal-pairs-ii,Hard,False
3542,Maximum Value Sum by Placing Three Rooks II,maximum-value-sum-by-placing-three-rooks-ii,Hard,False
3536,Find the Count of Monotonic Pairs II,find-the-count-of-monotonic-pairs-ii,Hard,False
3535,Find the Count of Monotonic Pairs I,find-the-count-of-monotonic-pairs-i,Hard,False
3532,Time Taken to Mark All Nodes,time-taken-to-mark-all-nodes,Hard,False
3531,Minimum Amount of Damage Dealt to Bob,minimum-amount-of-damage-dealt-to-bob,Hard,False
3527,Alternating Groups III,alternating-groups-iii,Hard,False
3514,Shortest Distance After Road Addition Queries II,shortest-distance-after-road-addition-queries-ii,Hard,False
3500,Minimum Cost for Cutting Cake II,minimum-cost-for-cutting-cake-ii,Hard,False
3482,Construct String with Minimum Cost,construct-string-with-minimum-cost,Hard,False
3478,Check if the Rectangle Corner Is Reachable,check-if-the-rectangle-corner-is-reachable,Hard,False
3470,Maximum Score From Grid Operations,maximum-score-from-grid-operations,Hard,False
3466,Number of Subarrays With AND Value of K,number-of-subarrays-with-and-value-of-k,Hard,False
3460,Count the Number of Inversions,count-the-number-of-inversions,Hard,False
3459,Find the Minimum Area to Cover All Ones II,find-the-minimum-area-to-cover-all-ones-ii,Hard,False
3454,Minimum Operations to Make Array Equal to Target,minimum-operations-to-make-array-equal-to-target,Hard,False
3452,Find the Maximum Length of a Good Subsequence II,find-the-maximum-length-of-a-good-subsequence-ii,Hard,False
3443,Maximum Total Reward Using Operations II,maximum-total-reward-using-operations-ii,Hard,False
3439,Find Minimum Diameter After Merging Two Trees,find-minimum-diameter-after-merging-two-trees,Hard,False
3438,Peaks in Array,peaks-in-array,Hard,False
3436,Find Subarray With Bitwise OR Closest to K,find-subarray-with-bitwise-or-closest-to-k,Hard,False
3435,Block Placement Queries,block-placement-queries,Hard,False
3431,Find the Minimum Cost Array Permutation,find-the-minimum-cost-array-permutation,Hard,False
3423,Maximum Sum of Subsequence With Non-adjacent Elements,maximum-sum-of-subsequence-with-non-adjacent-elements,Hard,False
3414,Find Number of Ways to Reach the K-th Stair,find-number-of-ways-to-reach-the-k-th-stair,Hard,False
3411,Find Products of Elements of Big Array,find-products-of-elements-of-big-array,Hard,False
3407,Find All Possible Stable Binary Arrays II,find-all-possible-stable-binary-arrays-ii,Hard,False
3402,Minimum Cost to Equalize Array,minimum-cost-to-equalize-array,Hard,False
3386,Find Edges in Shortest Paths,find-edges-in-shortest-paths,Hard,False
3382,Find the Number of Subarrays Where Boundary Elements Are Maximum,find-the-number-of-subarrays-where-boundary-elements-are-maximum,Hard,False
3376,Longest Common Suffix Queries,longest-common-suffix-queries,Hard,False
3375,Kth Smallest Amount With Single Denomination Combination,kth-smallest-amount-with-single-denomination-combination,Hard,False
3364,Minimum Sum of Values by Dividing Array,minimum-sum-of-values-by-dividing-array,Hard,False
3362,Find the Median of the Uniqueness Array,find-the-median-of-the-uniqueness-array,Hard,False
3350,Distribute Elements Into Two Arrays II,distribute-elements-into-two-arrays-ii,Hard,False
3348,Minimum Cost Walk in Weighted Graph,minimum-cost-walk-in-weighted-graph,Hard,False
3345,Find the Sum of the Power of All Subsequences,find-the-sum-of-the-power-of-all-subsequences,Hard,False
3344,Minimize Manhattan Distances,minimize-manhattan-distances,Hard,False
3327,Minimum Moves to Pick K Ones,minimum-moves-to-pick-k-ones,Hard,False
3316,Find the Sum of Subsequence Powers,find-the-sum-of-subsequence-powers,Hard,False
3313,Maximum Strength of K Disjoint Subarrays,maximum-strength-of-k-disjoint-subarrays,Hard,False
3310,Count the Number of Houses at a Certain Distance II,count-the-number-of-houses-at-a-certain-distance-ii,Hard,False
3307,Find the Maximum Sum of Node Values,find-the-maximum-sum-of-node-values,Hard,False
3305,Count Prefix and Suffix Pairs II,count-prefix-and-suffix-pairs-ii,Hard,False
3303,Find Beautiful Indices in the Given Array II,find-beautiful-indices-in-the-given-array-ii,Hard,False
3298,Maximize Consecutive Elements in an Array After Modification,maximize-consecutive-elements-in-an-array-after-modification,Hard,False
3296,Minimum Time to Revert Word to Initial State II,minimum-time-to-revert-word-to-initial-state-ii,Hard,False
3290,Number of Subarrays That Match a Pattern II,number-of-subarrays-that-match-a-pattern-ii,Hard,False
3289,Earliest Second to Mark Indices II,earliest-second-to-mark-indices-ii,Hard,False
3277,Find the Number of Ways to Place People II,find-the-number-of-ways-to-place-people-ii,Hard,False
3261,Minimize OR of Remaining Elements Using Operations,minimize-or-of-remaining-elements-using-operations,Hard,False
3260,Divide an Array Into Subarrays With Minimum Cost II,divide-an-array-into-subarrays-with-minimum-cost-ii,Hard,False
3248,Count the Number of Incremovable Subarrays II,count-the-number-of-incremovable-subarrays-ii,Hard,False
3243,Count the Number of Powerful Integers,count-the-number-of-powerful-integers,Hard,False
3238,Minimum Cost to Convert String II,minimum-cost-to-convert-string-ii,Hard,False
3233,Maximize the Number of Partitions After Operations,maximize-the-number-of-partitions-after-operations,Hard,False
3224,Count the Number of Infection Sequences,count-the-number-of-infection-sequences,Hard,False
3223,Count Complete Substrings,count-complete-substrings,Hard,False
3218,Find Number of Coins to Place in Tree Nodes,find-number-of-coins-to-place-in-tree-nodes,Hard,False
3217,Number of Possible Sets of Closing Branches,number-of-possible-sets-of-closing-branches,Hard,False
3212,Count the Number of Good Partitions,count-the-number-of-good-partitions,Hard,False
3211,Find Maximum Non-decreasing Array Length,find-maximum-non-decreasing-array-length,Hard,False
3208,Count Beautiful Substrings II,count-beautiful-substrings-ii,Hard,False
3203,Palindrome Rearrangement Queries,palindrome-rearrangement-queries,Hard,False
3197,Maximum Strong Pair XOR II,maximum-strong-pair-xor-ii,Hard,False
3196,Apply Operations to Maximize Frequency Score,apply-operations-to-maximize-frequency-score,Hard,False
3184,Maximum Balanced Subsequence Sum,maximum-balanced-subsequence-sum,Hard,False
3181,Find Building Where Alice and Bob Can Meet,find-building-where-alice-and-bob-can-meet,Hard,False
3179,Maximum Points After Collecting Coins From All Nodes,maximum-points-after-collecting-coins-from-all-nodes,Hard,False
3153,Apply Operations on Array to Maximize Sum of Squares,apply-operations-on-array-to-maximize-sum-of-squares,Hard,False
3140,Count Visited Nodes in a Directed Graph,count-visited-nodes-in-a-directed-graph,Hard,False
3139,Subarrays Distinct Element Sum of Squares II,subarrays-distinct-element-sum-of-squares-ii,Hard,False
3112,Count Valid Paths in a Tree,count-valid-paths-in-a-tree,Hard,False
3107,Maximum Spending After Buying Items,maximum-spending-after-buying-items,Hard,False
3105,Minimum Edge Reversals So Every Node Is Reachable,minimum-edge-reversals-so-every-node-is-reachable,Hard,False
3091,Count of Sub-Multisets With Bounded Sum,count-of-sub-multisets-with-bounded-sum,Hard,False
3079,Minimum Edge Weight Equilibrium Queries in a Tree,minimum-edge-weight-equilibrium-queries-in-a-tree,Hard,False
3058,Maximum Number of K-Divisible Components,maximum-number-of-k-divisible-components,Hard,False
3057,Count K-Subsequences of a String With Maximum Beauty,count-k-subsequences-of-a-string-with-maximum-beauty,Hard,False
3047,Maximum Element-Sum of a Complete Subset of Indices,maximum-element-sum-of-a-complete-subset-of-indices,Hard,False
3032,Maximize Value of Function in a Ball Passing Game,maximize-value-of-function-in-a-ball-passing-game,Hard,False
3025,Minimum Operations to Form Subsequence With Target Sum,minimum-operations-to-form-subsequence-with-target-sum,Hard,False
3024,String Transformation,string-transformation,Hard,False
3017,Number of Beautiful Integers in the Range,number-of-beautiful-integers-in-the-range,Hard,False
3001,Apply Operations to Maximize Score,apply-operations-to-maximize-score,Hard,False
2952,Minimum Time to Make Array Sum At Most x,minimum-time-to-make-array-sum-at-most-x,Hard,False
2921,Count Stepping Numbers in Range,count-stepping-numbers-in-range,Hard,False
2919,Maximum Number of Groups With Increasing Length,maximum-number-of-groups-with-increasing-length,Hard,False
2905,Count Paths That Can Form a Palindrome in a Tree,count-paths-that-can-form-a-palindrome-in-a-tree,Hard,False
2894,Maximum Elegance of a K-Length Subsequence,maximum-elegance-of-a-k-length-subsequence,Hard,False
2884,Length of the Longest Valid Substring,length-of-the-longest-valid-substring,Hard,False
2879,Minimum Changes to Make K Semi-palindromes,minimum-changes-to-make-k-semi-palindromes,Hard,False
2849,Sum of Imbalance Numbers of All Subarrays,sum-of-imbalance-numbers-of-all-subarrays,Hard,False
2846,Robot Collisions,robot-collisions,Hard,False
2839,Maximum Sum Queries,maximum-sum-queries,Hard,False
2827,Greatest Common Divisor Traversal,greatest-common-divisor-traversal,Hard,False
2826,Find a Good Subset of the Matrix,find-a-good-subset-of-the-matrix,Hard,False
2818,Maximum Strictly Increasing Cells in a Matrix,maximum-strictly-increasing-cells-in-a-matrix,Hard,False
2808,Painting the Walls,painting-the-walls,Hard,False
2803,Modify Graph Edge Weights,modify-graph-edge-weights,Hard,False
2788,Design Cancellable Function,design-cancellable-function,Hard,False
2784,Power of Heroes,power-of-heroes,Hard,False
2765,Make Array Empty,make-array-empty,Hard,False
2757,Count of Integers,count-of-integers,Hard,False
2744,Memoize II,memoize-ii,Hard,False
2739,Minimize the Total Price of the Trips,minimize-the-total-price-of-the-trips,Hard,False
2726,Minimum Reverse Operations,minimum-reverse-operations,Hard,False
2717,Collect Coins in a Tree,collect-coins-in-a-tree,Hard,False
2711,Minimum Time to Visit a Cell In a Grid,minimum-time-to-visit-a-cell-in-a-grid,Hard,False
2708,Find the String with LCP,find-the-string-with-lcp,Hard,False
2703,Handling Sum Queries After Update,handling-sum-queries-after-update,Hard,False
2701,Subsequence With the Minimum Score,subsequence-with-the-minimum-score,Hard,False
2697,Minimum Number of Visited Cells in a Grid,minimum-number-of-visited-cells-in-a-grid,Hard,False
2689,Rearranging Fruits,rearranging-fruits,Hard,False
2687,Lexicographically Smallest Beautiful String,lexicographically-smallest-beautiful-string,Hard,False
2682,Count Increasing Quadruplets,count-increasing-quadruplets,Hard,False
2681,Put Marbles in Bags,put-marbles-in-bags,Hard,False
2678,Design Graph With Shortest Path Calculator,design-graph-with-shortest-path-calculator,Hard,False
2671,Shortest Cycle in a Graph,shortest-cycle-in-a-graph,Hard,False
2657,Minimum Time to Complete All Tasks,minimum-time-to-complete-all-tasks,Hard,False
2652,Count Number of Possible Root Nodes,count-number-of-possible-root-nodes,Hard,False
2648,Number of Ways to Earn Points,number-of-ways-to-earn-points,Hard,False
2647,Split the Array to Make Coprime Products,split-the-array-to-make-coprime-products,Hard,False
2642,Time to Cross a Bridge,time-to-cross-a-bridge,Hard,False
2635,Check if Point Is Reachable,check-if-point-is-reachable,Hard,False
2633,Minimum Cost to Split an Array,minimum-cost-to-split-an-array,Hard,False
2627,Difference Between Maximum and Minimum Price Sum,difference-between-maximum-and-minimum-price-sum,Hard,False
2618,Maximize the Minimum Powered City,maximize-the-minimum-powered-city,Hard,False
2605,Count Anagrams,count-anagrams,Hard,False
2601,Number of Great Partitions,number-of-great-partitions,Hard,False
2597,Cycle Length Queries in a Tree,cycle-length-queries-in-a-tree,Hard,False
2596,Add Edges to Make Degrees of All Nodes Even,add-edges-to-make-degrees-of-all-nodes-even,Hard,False
2592,Minimum Total Cost to Make Arrays Unequal,minimum-total-cost-to-make-arrays-unequal,Hard,False
2588,Maximum Number of Points From Grid Queries,maximum-number-of-points-from-grid-queries,Hard,False
2583,Divide Nodes Into the Maximum Number of Groups,divide-nodes-into-the-maximum-number-of-groups,Hard,False
2577,Count Palindromic Subsequences,count-palindromic-subsequences,Hard,False
2574,Count Subarrays With Median K,count-subarrays-with-median-k,Hard,False
2569,Number of Beautiful Partitions,number-of-beautiful-partitions,Hard,False
2563,Split Message Based on Limit,split-message-based-on-limit,Hard,False
2559,Maximum Number of Non-overlapping Palindrome Substrings,maximum-number-of-non-overlapping-palindrome-substrings,Hard,False
2554,Minimum Total Distance Traveled,minimum-total-distance-traveled,Hard,False
2549,Next Greater Element IV,next-greater-element-iv,Hard,False
2545,Height of Binary Tree After Subtree Removal Queries,height-of-binary-tree-after-subtree-removal-queries,Hard,False
2539,Minimum Number of Operations to Make Arrays Similar,minimum-number-of-operations-to-make-arrays-similar,Hard,False
2538,Minimum Cost to Make Array Equal,minimum-cost-to-make-array-equal,Hard,False
2531,Create Components With Same Value,create-components-with-same-value,Hard,False
2527,Count Subarrays With Fixed Bounds,count-subarrays-with-fixed-bounds,Hard,False
2526,Longest Increasing Subsequence II,longest-increasing-subsequence-ii,Hard,False
2521,Paths in Matrix Whose Sum Is Divisible by K,paths-in-matrix-whose-sum-is-divisible-by-k,Hard,False
2513,Number of Pairs Satisfying Inequality,number-of-pairs-satisfying-inequality,Hard,False
2510,Maximum Deletions on a String,maximum-deletions-on-a-string,Hard,False
2505,Number of Good Paths,number-of-good-paths,Hard,False
2499,Minimum Money Required Before Transactions,minimum-money-required-before-transactions,Hard,False
2494,Sum of Prefix Scores of Strings,sum-of-prefix-scores-of-strings,Hard,False
2479,Meeting Rooms III,meeting-rooms-iii,Hard,False
2472,Build a Matrix With Conditions,build-a-matrix-with-conditions,Hard,False
2466,Maximum Segment Sum After Removals,maximum-segment-sum-after-removals,Hard,False
2462,Find the K-Sum of an Array,find-the-k-sum-of-an-array,Hard,False
2457,Count Special Integers,count-special-integers,Hard,False
2450,Minimum Replacements to Sort the Array,minimum-replacements-to-sort-the-array,Hard,False
2449,Maximum Number of Robots Within Budget,maximum-number-of-robots-within-budget,Hard,False
2439,Longest Cycle in a Graph,longest-cycle-in-a-graph,Hard,False
2435,Shortest Impossible Sequence of Rolls,shortest-impossible-sequence-of-rolls,Hard,False
2430,Number of Excellent Pairs,number-of-excellent-pairs,Hard,False
2423,Minimum Deletions to Make Array Divisible,minimum-deletions-to-make-array-divisible,Hard,False
2419,Subarray With Elements Greater Than Varying Threshold,subarray-with-elements-greater-than-varying-threshold,Hard,False
2415,Count the Number of Ideal Arrays,count-the-number-of-ideal-arrays,Hard,False
2409,Number of Increasing Paths in a Grid,number-of-increasing-paths-in-a-grid,Hard,False
2404,Number of Distinct Roll Sequences,number-of-distinct-roll-sequences,Hard,False
2400,Minimum Score After Removals on a Tree,minimum-score-after-removals-on-a-tree,Hard,False
2394,Count Subarrays With Score Less Than K,count-subarrays-with-score-less-than-k,Hard,False
2393,Match Substring After Replacement,match-substring-after-replacement,Hard,False
2390,Naming a Company,naming-a-company,Hard,False
2389,Design a Text Editor,design-a-text-editor,Hard,False
2380,Booking Concert Tickets in Groups,booking-concert-tickets-in-groups,Hard,False
2375,Minimum Obstacle Removal to Reach Corner,minimum-obstacle-removal-to-reach-corner,Hard,False
2368,Sum of Total Strength of Wizards,sum-of-total-strength-of-wizards,Hard,False
2364,Longest Path With Different Adjacent Characters,longest-path-with-different-adjacent-characters,Hard,False
2360,Substring With Largest Variance,substring-with-largest-variance,Hard,False
2357,Count Integers in Intervals,count-integers-in-intervals,Hard,False
2353,Maximum Score of a Node Sequence,maximum-score-of-a-node-sequence,Hard,False
2349, Check if There Is a Valid Parentheses String Path,check-if-there-is-a-valid-parentheses-string-path,Hard,False
2344,Escape the Spreading Fire,escape-the-spreading-fire,Hard,False
2340,Total Appeal of A String,total-appeal-of-a-string,Hard,False
2334,Number of Flowers in Full Bloom,number-of-flowers-in-full-bloom,Hard,False
2330,Maximum Total Beauty of the Gardens,maximum-total-beauty-of-the-gardens,Hard,False
2326,Sum of Scores of Built Strings,sum-of-scores-of-built-strings,Hard,False
2321,Minimum Weighted Subgraph With the Required Paths,minimum-weighted-subgraph-with-the-required-paths,Hard,False
2319,Longest Substring of One Repeating Character,longest-substring-of-one-repeating-character,Hard,False
2311,Minimum White Tiles After Covering With Carpets,minimum-white-tiles-after-covering-with-carpets,Hard,False
2307,Replace Non-Coprime Numbers in Array,replace-non-coprime-numbers-in-array,Hard,False
2301,Count Array Pairs Divisible by K,count-array-pairs-divisible-by-k,Hard,False
2295,Minimum Time to Finish the Race,minimum-time-to-finish-the-race,Hard,False
2291,Maximum AND Sum of Array,maximum-and-sum-of-array,Hard,False
2286,Minimum Time to Remove All Cars Containing Illegal Goods,minimum-time-to-remove-all-cars-containing-illegal-goods,Hard,False
2280,Count Good Triplets in an Array,count-good-triplets-in-an-array,Hard,False
2276,Groups of Strings,groups-of-strings,Hard,False
2275,Find Substring With Given Hash Value,find-substring-with-given-hash-value,Hard,False
2272,Maximum Good People Based on Statements,maximum-good-people-based-on-statements,Hard,False
2267,Minimum Difference in Sums After Removal of Elements,minimum-difference-in-sums-after-removal-of-elements,Hard,False
2263,Maximum Running Time of N Computers,maximum-running-time-of-n-computers,Hard,False
2257,Earliest Possible Day of Full Bloom,earliest-possible-day-of-full-bloom,Hard,False
2251,Number of Ways to Divide a Long Corridor,number-of-ways-to-divide-a-long-corridor,Hard,False
2246,Maximum Employees to Be Invited to a Meeting,maximum-employees-to-be-invited-to-a-meeting,Hard,False
2241,Recover the Original Array,recover-the-original-array,Hard,False
2234,Minimum Operations to Make the Array K-Increasing,minimum-operations-to-make-the-array-k-increasing,Hard,False
2229,Maximum Fruits Harvested After at Most K Steps,maximum-fruits-harvested-after-at-most-k-steps,Hard,False
2222,Abbreviating the Product of a Range,abbreviating-the-product-of-a-range,Hard,False
2213,Find All People With Secret,find-all-people-with-secret,Hard,False
2207,Sequentially Ordinal Rank Tracker,sequentially-ordinal-rank-tracker,Hard,False
2202,Sum of k-Mirror Numbers,sum-of-k-mirror-numbers,Hard,False
2201,Valid Arrangement of Pairs,valid-arrangement-of-pairs,Hard,False
2200,Stamping the Grid,stamping-the-grid,Hard,False
2198,Process Restricted Friend Requests,process-restricted-friend-requests,Hard,False
2193,Count Fertile Pyramids in a Land,count-fertile-pyramids-in-a-land,Hard,False
2189,Maximum Path Quality of a Graph,maximum-path-quality-of-a-graph,Hard,False
2184,Check if an Original String Exists Given Two Encoded Strings,check-if-an-original-string-exists-given-two-encoded-strings,Hard,False
2180,Maximum Number of Tasks You Can Assign,maximum-number-of-tasks-you-can-assign,Hard,False
2176,Parallel Courses III,parallel-courses-iii,Hard,False
2171,Second Minimum Time to Reach Destination,second-minimum-time-to-reach-destination,Hard,False
2166,Number of Valid Move Combinations On Chessboard,number-of-valid-move-combinations-on-chessboard,Hard,False
2162,Partition Array Into Two Arrays to Minimize Sum Difference,partition-array-into-two-arrays-to-minimize-sum-difference,Hard,False
2157,Smallest K-Length Subsequence With Occurrences of a Letter,smallest-k-length-subsequence-with-occurrences-of-a-letter,Hard,False
2150,Kth Smallest Product of Two Sorted Arrays,kth-smallest-product-of-two-sorted-arrays,Hard,False
2147,The Score of Students Solving Math Expression,the-score-of-students-solving-math-expression,Hard,False
2140,Longest Subsequence Repeated k Times,longest-subsequence-repeated-k-times,Hard,False
2135,Maximum Number of Ways to Partition an Array,maximum-number-of-ways-to-partition-an-array,Hard,False
2131,Smallest Missing Genetic Value in Each Subtree,smallest-missing-genetic-value-in-each-subtree,Hard,False
2125,GCD Sort of an Array,gcd-sort-of-an-array,Hard,False
2119,Minimum Number of Operations to Make Array Continuous,minimum-number-of-operations-to-make-array-continuous,Hard,False
2115,Number of Unique Good Subsequences,number-of-unique-good-subsequences,Hard,False
2109,Find Array Given Subset Sums,find-array-given-subset-sums,Hard,False
2105,The Number of Good Subsets,the-number-of-good-subsets,Hard,False
2101,Last Day Where You Can Still Cross,last-day-where-you-can-still-cross,Hard,False
2096,Find the Longest Valid Obstacle Course at Each Position,find-the-longest-valid-obstacle-course-at-each-position,Hard,False
2091,Number of Ways to Separate Numbers,number-of-ways-to-separate-numbers,Hard,False
2086,Count Number of Special Subsequences,count-number-of-special-subsequences,Hard,False
2079,Delete Duplicate Folders in System,delete-duplicate-folders-in-system,Hard,False
2068,Maximum Genetic Difference Query,maximum-genetic-difference-query,Hard,False
2061,Painting a Grid With Three Different Colors,painting-a-grid-with-three-different-colors,Hard,False
2060,Merge BSTs to Create Single BST,merge-bsts-to-create-single-bst,Hard,False
2051,Longest Common Subpath,longest-common-subpath,Hard,False
2040,Minimum Cost to Reach Destination in Time,minimum-cost-to-reach-destination-in-time,Hard,False
2028,The Earliest and Latest Rounds Where Players Compete,the-earliest-and-latest-rounds-where-players-compete,Hard,False
2023,Design Movie Rental System,design-movie-rental-system,Hard,False
2018,Minimum Space Wasted From Packaging,minimum-space-wasted-from-packaging,Hard,False
2013,Minimum Skips to Arrive at Meeting On Time,minimum-skips-to-arrive-at-meeting-on-time,Hard,False
2008,Minimum Cost to Change the Final Value of Expression,minimum-cost-to-change-the-final-value-of-expression,Hard,False
2002,Stone Game VIII,stone-game-viii,Hard,False
1996,Number of Ways to Rearrange Sticks With K Sticks Visible,number-of-ways-to-rearrange-sticks-with-k-sticks-visible,Hard,False
1989,Minimum XOR Sum of Two Arrays,minimum-xor-sum-of-two-arrays,Hard,False
1986,Largest Color Value in a Directed Graph,largest-color-value-in-a-directed-graph,Hard,False
1977,Minimum Interval to Include Each Query,minimum-interval-to-include-each-query,Hard,False
1968,Maximum Building Height,maximum-building-height,Hard,False
1963,Find XOR Sum of All Pairs Bitwise AND,find-xor-sum-of-all-pairs-bitwise-and,Hard,False
1957,Closest Room,closest-room,Hard,False
1953,Finding MK Average,finding-mk-average,Hard,False
1947,Number of Different Subsequences GCDs,number-of-different-subsequences-gcds,Hard,False
1941,Minimum Number of Operations to Make String Sorted,minimum-number-of-operations-to-make-string-sorted,Hard,False
1936,Maximize Number of Nice Divisors,maximize-number-of-nice-divisors,Hard,False
1924,Maximum Number of Groups Getting Fresh Donuts,maximum-number-of-groups-getting-fresh-donuts,Hard,False
1918,Maximum Score of a Good Subarray,maximum-score-of-a-good-subarray,Hard,False
1913,Make the XOR of All Segments Equal to Zero,make-the-xor-of-all-segments-equal-to-zero,Hard,False
1907,Count Pairs With XOR in a Range,count-pairs-with-xor-in-a-range,Hard,False
1906,Maximize Score After N Operations,maximize-score-after-n-operations,Hard,False
1902,Car Fleet II,car-fleet-ii,Hard,False
1897,Maximize Palindrome Length From Subsequences,maximize-palindrome-length-from-subsequences,Hard,False
1896,Maximum Score from Performing Multiplication Operations,maximum-score-from-performing-multiplication-operations,Hard,False
1891,Count Pairs Of Nodes,count-pairs-of-nodes,Hard,False
1887,Minimum Degree of a Connected Trio in a Graph,minimum-degree-of-a-connected-trio-in-a-graph,Hard,False
1881,Closest Subsequence Sum,closest-subsequence-sum,Hard,False
1875,Tree of Coprimes,tree-of-coprimes,Hard,False
1871,Palindrome Partitioning IV,palindrome-partitioning-iv,Hard,False
1861,Building Boxes,building-boxes,Hard,False
