id,title,slug,difficulty,paid_only
3241,Divide Array Into Arrays With Max Difference,divide-array-into-arrays-with-max-difference,Medium,False
3240,Maximum Number That Sum of the Prices Is Less Than or Equal to K,maximum-number-that-sum-of-the-prices-is-less-than-or-equal-to-k,Medium,False
3239,Minimum Number of Operations to Make X and Y Equal,minimum-number-of-operations-to-make-x-and-y-equal,Medium,False
3235,Minimum Cost to Convert String I,minimum-cost-to-convert-string-i,Medium,False
3234,Double Modular Exponentiation,double-modular-exponentiation,Medium,False
3231,Minimum Number of Coins to be Added,minimum-number-of-coins-to-be-added,Medium,False
3230,Remove Adjacent Almost-Equal Characters,remove-adjacent-almost-equal-characters,Medium,False
3229,Minimum Cost to Make Array Equalindromic,minimum-cost-to-make-array-equalindromic,Medium,False
3228,Maximum Size of a Set After Removals,maximum-size-of-a-set-after-removals,Medium,False
3225,Length of Longest Subarray With at Most K Frequency,length-of-longest-subarray-with-at-most-k-frequency,Medium,False
3219,Make Lexicographically Smallest Array by Swapping Elements,make-lexicographically-smallest-array-by-swapping-elements,Medium,False
3214,Maximize Area of Square Hole in Grid,maximize-area-of-square-hole-in-grid,Medium,False
3213,Count Subarrays Where Max Element Appears at Least K Times,count-subarrays-where-max-element-appears-at-least-k-times,Medium,False
3210,Count Beautiful Substrings I,count-beautiful-substrings-i,Medium,False
3209,Minimum Number of Coins for Fruits,minimum-number-of-coins-for-fruits,Medium,False
3202,High-Access Employees,high-access-employees,Medium,False
3201,Distribute Candies Among Children II,distribute-candies-among-children-ii,Medium,False
3200,Number of Strings Which Can Be Rearranged to Contain Substring,number-of-strings-which-can-be-rearranged-to-contain-substring,Medium,False
3195,Separate Black and White Balls,separate-black-and-white-balls,Medium,False
3192,Maximum Xor Product,maximum-xor-product,Medium,False
3191,Maximum Score After Applying Operations on a Tree,maximum-score-after-applying-operations-on-a-tree,Medium,False
3190,Minimum Operations to Maximize Last Elements in Arrays,minimum-operations-to-maximize-last-elements-in-arrays,Medium,False
3189,Find Champion II,find-champion-ii,Medium,False
3186,Minimum Sum of Mountain Triplets II,minimum-sum-of-mountain-triplets-ii,Medium,False
3178,Minimum Increment Operations to Make Array Beautiful,minimum-increment-operations-to-make-array-beautiful,Medium,False
3174,Minimum Number of Changes to Make Binary String Beautiful,minimum-number-of-changes-to-make-binary-string-beautiful,Medium,False
3171,Minimum Equal Sum of Two Arrays After Replacing Zeros,minimum-equal-sum-of-two-arrays-after-replacing-zeros,Medium,False
3170,Find Indices With Index and Value Difference II,find-indices-with-index-and-value-difference-ii,Medium,False
3166,Minimum Number of Groups to Create a Valid Assignment,minimum-number-of-groups-to-create-a-valid-assignment,Medium,False
3152,Maximum Value of an Ordered Triplet II,maximum-value-of-an-ordered-triplet-ii,Medium,False
3151,Minimum Processing Time,minimum-processing-time,Medium,False
3150,Shortest and Lexicographically Smallest Beautiful String,shortest-and-lexicographically-smallest-beautiful-string,Medium,False
3142,Longest Unequal Adjacent Groups Subsequence II,longest-unequal-adjacent-groups-subsequence-ii,Medium,False
3141,Minimum Size Subarray in Infinite Array,minimum-size-subarray-in-infinite-array,Medium,False
3114,Beautiful Towers I,beautiful-towers-i,Medium,False
3113,Beautiful Towers II,beautiful-towers-ii,Medium,False
3106,Length of the Longest Subsequence That Sums to Target,length-of-the-longest-subsequence-that-sums-to-target,Medium,False
3104,Happy Students,happy-students,Medium,False
3095,Maximum Number of Alloys,maximum-number-of-alloys,Medium,False
3094,Minimum Number of Operations to Make Array Empty,minimum-number-of-operations-to-make-array-empty,Medium,False
3092,Minimum Moves to Spread Stones Over Grid,minimum-moves-to-spread-stones-over-grid,Medium,False
3081,Minimum Array Length After Pair Removals,minimum-array-length-after-pair-removals,Medium,False
3080,Split Array Into Maximum Number of Subarrays,split-array-into-maximum-number-of-subarrays,Medium,False
3056,Determine if a Cell Is Reachable at a Given Time,determine-if-a-cell-is-reachable-at-a-given-time,Medium,False
3046,Minimum Operations to Make a Special Number,minimum-operations-to-make-a-special-number,Medium,False
3033,Apply Operations to Make Two Strings Equal,apply-operations-to-make-two-strings-equal,Medium,False
3031,Construct Product Matrix,construct-product-matrix,Medium,False
3026,Find the Minimum Possible Sum of a Beautiful Array,find-the-minimum-possible-sum-of-a-beautiful-array,Medium,False
3018,Make String a Subsequence Using Cyclic Increments,make-string-a-subsequence-using-cyclic-increments,Medium,False
3000,Minimum Absolute Difference Between Elements With Constraint,minimum-absolute-difference-between-elements-with-constraint,Medium,False
2979,Maximize the Profit as the Salesman,maximize-the-profit-as-the-salesman,Medium,False
2978,Check if Strings Can be Made Equal With Operations II,check-if-strings-can-be-made-equal-with-operations-ii,Medium,False
2954,Maximum Sum of Almost Unique Subarray,maximum-sum-of-almost-unique-subarray,Medium,False
2953,Count Pairs of Points With Distance k,count-pairs-of-points-with-distance-k,Medium,False
2920,Minimum Seconds to Equalize a Circular Array,minimum-seconds-to-equalize-a-circular-array,Medium,False
2916,Check if it is Possible to Split Array,check-if-it-is-possible-to-split-array,Medium,False
2915,Count of Interesting Subarrays,count-of-interesting-subarrays,Medium,False
2914,Find the Safest Path in a Grid,find-the-safest-path-in-a-grid,Medium,False
2904,Sorting Three Groups,sorting-three-groups,Medium,False
2903,Insert Greatest Common Divisors in Linked List,insert-greatest-common-divisors-in-linked-list,Medium,False
2893,Visit Array Positions to Maximize Score,visit-array-positions-to-maximize-score,Medium,False
2891,Maximum Beauty of an Array After Applying Operation,maximum-beauty-of-an-array-after-applying-operation,Medium,False
2889,Number of Black Blocks,number-of-black-blocks,Medium,False
2888,Minimum Index of a Valid Split,minimum-index-of-a-valid-split,Medium,False
2887,Sort Vowels in a String,sort-vowels-in-a-string,Medium,False
2883,Partition String Into Minimum Beautiful Substrings,partition-string-into-minimum-beautiful-substrings,Medium,False
2882,Ways to Express an Integer as Sum of Powers,ways-to-express-an-integer-as-sum-of-powers,Medium,False
2878,Apply Operations to Make All Array Elements Equal to Zero,apply-operations-to-make-all-array-elements-equal-to-zero,Medium,False
2877,Shortest String That Contains Three Strings,shortest-string-that-contains-three-strings,Medium,False
2873,Prime Pairs With Target Sum,prime-pairs-with-target-sum,Medium,False
2872,Largest Element in an Array after Merge Operations,largest-element-in-an-array-after-merge-operations,Medium,False
2871,Double a Number Represented as a Linked List,double-a-number-represented-as-a-linked-list,Medium,False
2869,Longest Non-decreasing Subarray From Two Arrays,longest-non-decreasing-subarray-from-two-arrays,Medium,False
2868,Continuous Subarrays,continuous-subarrays,Medium,False
2867,Ways to Split Array Into Good Subarrays,ways-to-split-array-into-good-subarrays,Medium,False
2858,Join Two Arrays by ID,join-two-arrays-by-id,Medium,False
2856,Count Complete Subarrays in an Array,count-complete-subarrays-in-an-array,Medium,False
2855,Maximum Number of Jumps to Reach the Last Index,maximum-number-of-jumps-to-reach-the-last-index,Medium,False
2854,Decremental String Concatenation,decremental-string-concatenation,Medium,False
2850,Construct the Longest New String,construct-the-longest-new-string,Medium,False
2848,Special Permutations,special-permutations,Medium,False
2845,Find the Value of the Partition,find-the-value-of-the-partition,Medium,False
2838,Sum of Matrix After Queries,sum-of-matrix-after-queries,Medium,False
2837,Minimum Operations to Make the Integer Zero,minimum-operations-to-make-the-integer-zero,Medium,False
2834,Relocate Marbles,relocate-marbles,Medium,False
2833,Count Zero Request Servers,count-zero-request-servers,Medium,False
2832,Find the Longest Equal Subarray,find-the-longest-equal-subarray,Medium,False
2828,Lexicographically Smallest String After Substring Operation,lexicographically-smallest-string-after-substring-operation,Medium,False
2817,Minimum Cost to Make All Characters Equal,minimum-cost-to-make-all-characters-equal,Medium,False
2811,Determine the Minimum Sum of a k-avoiding Array,determine-the-minimum-sum-of-a-k-avoiding-array,Medium,False
2810,Collecting Chocolates,collecting-chocolates,Medium,False
2807,Execute Asynchronous Functions in Parallel,execute-asynchronous-functions-in-parallel,Medium,False
2804,Compact Object,compact-object,Medium,False
2802,Find the Punishment Number of an Integer,find-the-punishment-number-of-an-integer,Medium,False
2801,Difference of Number of Distinct Values on Diagonals,difference-of-number-of-distinct-values-on-diagonals,Medium,False
2797,Event Emitter,event-emitter,Medium,False
2794,Maximum Number of Moves in a Grid,maximum-number-of-moves-in-a-grid,Medium,False
2793,Count the Number of Complete Components,count-the-number-of-complete-components,Medium,False
2792,Neighboring Bitwise XOR,neighboring-bitwise-xor,Medium,False
2790,Call Function with Custom Context,call-function-with-custom-context,Medium,False
2787,Movement of Robots,movement-of-robots,Medium,False
2786,Find the Longest Semi-Repetitive Substring,find-the-longest-semi-repetitive-substring,Medium,False
2783,Nested Array Generator,nested-array-generator,Medium,False
2780,Make Costs of Paths Equal in a Binary Tree,make-costs-of-paths-equal-in-a-binary-tree,Medium,False
2779,Number of Adjacent Elements With the Same Color,number-of-adjacent-elements-with-the-same-color,Medium,False
2778,Frequency Tracker,frequency-tracker,Medium,False
2766,Find the Prefix Common Array of Two Arrays,find-the-prefix-common-array-of-two-arrays,Medium,False
2764,Maximum Number of Fish in a Grid,maximum-number-of-fish-in-a-grid,Medium,False
2762,Cache With Time Limit,cache-with-time-limit,Medium,False
2760,Snail Traversal,snail-traversal,Medium,False
2759,Flatten Deeply Nested Array,flatten-deeply-nested-array,Medium,False
2758,Check if Object Instance of Class,check-if-object-instance-of-class,Medium,False
2755,Extra Characters in a String,extra-characters-in-a-string,Medium,False
2754,Maximum Strength of a Group,maximum-strength-of-a-group,Medium,False
2753,Minimum Number of Operations to Make All Array Elements Equal to 1,minimum-number-of-operations-to-make-all-array-elements-equal-to-1,Medium,False
2751,Sliding Subarray Beauty,sliding-subarray-beauty,Medium,False
2749,Promise Time Limit,promise-time-limit,Medium,False
2743,Debounce,debounce,Medium,False
2742,Group By,group-by,Medium,False
2736,Minimum Additions to Make Valid String,minimum-additions-to-make-valid-string,Medium,False
2731,Memoize,memoize,Medium,False
2730,Maximum OR,maximum-or,Medium,False
2728,Sum in a Matrix,sum-in-a-matrix,Medium,False
2725,Mice and Cheese,mice-and-cheese,Medium,False
2724,Convert an Array Into a 2D Array With Conditions,convert-an-array-into-a-2d-array-with-conditions,Medium,False
2721,Sum of Distances,sum-of-distances,Medium,False
2720,Minimize the Maximum Difference of Pairs,minimize-the-maximum-difference-of-pairs,Medium,False
2718,Minimum Operations to Make All Array Elements Equal,minimum-operations-to-make-all-array-elements-equal,Medium,False
2716,Prime Subtraction Operation,prime-subtraction-operation,Medium,False
2713,Find the Divisibility Array of a String,find-the-divisibility-array-of-a-string,Medium,False
2712,Find the Maximum Number of Marked Indices,find-the-maximum-number-of-marked-indices,Medium,False
2710,Minimum Operations to Reduce an Integer to 0,minimum-operations-to-reduce-an-integer-to-0,Medium,False
2709,Count the Number of Square-Free Subsets,count-the-number-of-square-free-subsets,Medium,False
2706,Minimum Score by Changing Two Elements,minimum-score-by-changing-two-elements,Medium,False
2705,Minimum Impossible OR,minimum-impossible-or,Medium,False
2700,Substring XOR Queries,substring-xor-queries,Medium,False
2699,Count the Number of Fair Pairs,count-the-number-of-fair-pairs,Medium,False
2696,The Number of Beautiful Subsets,the-number-of-beautiful-subsets,Medium,False
2695,Find Score of an Array After Marking All Elements,find-score-of-an-array-after-marking-all-elements,Medium,False
2691,Count Vowel Strings in Ranges,count-vowel-strings-in-ranges,Medium,False
2690,House Robber IV,house-robber-iv,Medium,False
2686,Minimum Cost of a Path With Special Roads,minimum-cost-of-a-path-with-special-roads,Medium,False
2685,First Completely Painted Row or Column,first-completely-painted-row-or-column,Medium,False
2680,Count Collisions of Monkeys on a Polygon,count-collisions-of-monkeys-on-a-polygon,Medium,False
2677,Cousins in Binary Tree II,cousins-in-binary-tree-ii,Medium,False
2676,Find the Score of All Prefixes of an Array,find-the-score-of-all-prefixes-of-an-array,Medium,False
2673,Maximize Win From Two Segments,maximize-win-from-two-segments,Medium,False
2670,Make K-Subarray Sums Equal,make-k-subarray-sums-equal,Medium,False
2669,Find the Substring With Maximum Cost,find-the-substring-with-maximum-cost,Medium,False
2665,Minimum Time to Repair Cars,minimum-time-to-repair-cars,Medium,False
2664,Maximize Greatness of an Array,maximize-greatness-of-an-array,Medium,False
2662,Check Knight Tour Configuration,check-knight-tour-configuration,Medium,False
2661,Smallest Missing Non-negative Integer After Operations,smallest-missing-non-negative-integer-after-operations,Medium,False
2656,Count the Number of Beautiful Subarrays,count-the-number-of-beautiful-subarrays,Medium,False
2655,Rearrange Array to Maximize Prefix Score,rearrange-array-to-maximize-prefix-score,Medium,False
2651,Count Ways to Group Overlapping Ranges,count-ways-to-group-overlapping-ranges,Medium,False
2649,Count Total Number of Colored Cells,count-total-number-of-colored-cells,Medium,False
2646,Kth Largest Sum in a Binary Tree,kth-largest-sum-in-a-binary-tree,Medium,False
2641,Disconnect Path in a Binary Matrix by at Most One Flip,disconnect-path-in-a-binary-matrix-by-at-most-one-flip,Medium,False
2640,Maximum Number of Integers to Choose From a Range I,maximum-number-of-integers-to-choose-from-a-range-i,Medium,False
2636,Maximum Subsequence Score,maximum-subsequence-score,Medium,False
2632,Apply Bitwise Operations to Make Strings Equal,apply-bitwise-operations-to-make-strings-equal,Medium,False
2631,Sort the Students by Their Kth Score,sort-the-students-by-their-kth-score,Medium,False
2628,Minimize the Maximum of Two Arrays,minimize-the-maximum-of-two-arrays,Medium,False
2626,Count the Number of Good Subarrays,count-the-number-of-good-subarrays,Medium,False
2625,Increment Submatrices by One,increment-submatrices-by-one,Medium,False
2621,Find Xor-Beauty of Array,find-xor-beauty-of-array,Medium,False
2620,Find Consecutive Integers from a Data Stream,find-consecutive-integers-from-a-data-stream,Medium,False
2616,Maximal Score After Applying K Operations,maximal-score-after-applying-k-operations,Medium,False
2615,Make Number of Distinct Characters Equal,make-number-of-distinct-characters-equal,Medium,False
2610,Closest Prime Numbers in Range,closest-prime-numbers-in-range,Medium,False
2609,Distinct Prime Factors of Product of Array,distinct-prime-factors-of-product-of-array,Medium,False
2606,Difference Between Ones and Zeros in Row and Column,difference-between-ones-and-zeros-in-row-and-column,Medium,False
2604,Minimum Operations to Make Array Equal II,minimum-operations-to-make-array-equal-ii,Medium,False
2603,Reward Top K Students,reward-top-k-students,Medium,False
2600,Maximum Tastiness of Candy Basket,maximum-tastiness-of-candy-basket,Medium,False
2599,Take K of Each Character From Left and Right,take-k-of-each-character-from-left-and-right,Medium,False
2595,Smallest Value After Replacing With Sum of Prime Factors,smallest-value-after-replacing-with-sum-of-prime-factors,Medium,False
2591,Frog Jump II,frog-jump-ii,Medium,False
2590,Maximum Star Sum of a Graph,maximum-star-sum-of-a-graph,Medium,False
2587,Design Memory Allocator,design-memory-allocator,Medium,False
2586,Longest Square Streak in an Array,longest-square-streak-in-an-array,Medium,False
2582,Minimum Score of a Path Between Two Cities,minimum-score-of-a-path-between-two-cities,Medium,False
2581,Divide Players Into Teams of Equal Skill,divide-players-into-teams-of-equal-skill,Medium,False
2576,Minimum Penalty for a Shop,minimum-penalty-for-a-shop,Medium,False
2573,Remove Nodes From Linked List,remove-nodes-from-linked-list,Medium,False
2572,Append Characters to String to Make Subsequence,append-characters-to-string-to-make-subsequence,Medium,False
2568,Minimum Fuel Cost to Report to the Capital,minimum-fuel-cost-to-report-to-the-capital,Medium,False
2567,Closest Nodes Queries in a Binary Search Tree,closest-nodes-queries-in-a-binary-search-tree,Medium,False
2564,Most Profitable Path in a Tree,most-profitable-path-in-a-tree,Medium,False
2562,Count Ways To Build Good Strings,count-ways-to-build-good-strings,Medium,False
2558,Minimum Number of Operations to Sort a Binary Tree by Level,minimum-number-of-operations-to-sort-a-binary-tree-by-level,Medium,False
2557,Number of Subarrays With LCM Equal to K,number-of-subarrays-with-lcm-equal-to-k,Medium,False
2553,Total Cost to Hire K Workers,total-cost-to-hire-k-workers,Medium,False
2552,Maximum Sum of Distinct Subarrays With Length K,maximum-sum-of-distinct-subarrays-with-length-k,Medium,False
2550,Words Within Two Edits of Dictionary,words-within-two-edits-of-dictionary,Medium,False
2548,Destroy Sequential Targets,destroy-sequential-targets,Medium,False
2546,Number of Subarrays With GCD Equal to K,number-of-subarrays-with-gcd-equal-to-k,Medium,False
2544,Minimum Addition to Make Integer Beautiful,minimum-addition-to-make-integer-beautiful,Medium,False
2543,Most Popular Video Creator,most-popular-video-creator,Medium,False
2541,Sum of Number and Its Reverse,sum-of-number-and-its-reverse,Medium,False
2533,Bitwise XOR of All Pairings,bitwise-xor-of-all-pairings,Medium,False
2530,Minimize Maximum of Array,minimize-maximum-of-array,Medium,False
2529,Range Product Queries of Powers,range-product-queries-of-powers,Medium,False
2525,Count Number of Distinct Integers After Reverse Operations,count-number-of-distinct-integers-after-reverse-operations,Medium,False
2520,Using a Robot to Print the Lexicographically Smallest String,using-a-robot-to-print-the-lexicographically-smallest-string,Medium,False
2519,Find The Original Array of Prefix Xor,find-the-original-array-of-prefix-xor,Medium,False
2512,Longest Uploaded Prefix,longest-uploaded-prefix,Medium,False
2511,Partition String Into Substrings With Values at Most K,partition-string-into-substrings-with-values-at-most-k,Medium,False
2509,Minimize XOR,minimize-xor,Medium,False
2508,Maximum Sum of an Hourglass,maximum-sum-of-an-hourglass,Medium,False
2504,Find All Good Indices,find-all-good-indices,Medium,False
2503,Longest Subarray With Maximum Bitwise AND,longest-subarray-with-maximum-bitwise-and,Medium,False
2498,Smallest Subarrays With Maximum Bitwise OR,smallest-subarrays-with-maximum-bitwise-or,Medium,False
2497,Maximum Matching of Players With Trainers,maximum-matching-of-players-with-trainers,Medium,False
2493,Reverse Odd Levels of Binary Tree,reverse-odd-levels-of-binary-tree,Medium,False
2492,Length of the Longest Alphabetical Continuous Substring,length-of-the-longest-alphabetical-continuous-substring,Medium,False
2488,Divide Intervals Into Minimum Number of Groups,divide-intervals-into-minimum-number-of-groups,Medium,False
2487,Optimal Partition of String,optimal-partition-of-string,Medium,False
3828,Analyze Organization Hierarchy,analyze-organization-hierarchy,Hard,False
3801,Count Beautiful Numbers,count-beautiful-numbers,Hard,False
3798,Longest Special Path II,longest-special-path-ii,Hard,False
3792,Find Invalid IP Addresses,find-invalid-ip-addresses,Hard,False
3789,Maximize Subarrays After Removing One Conflicting Pair,maximize-subarrays-after-removing-one-conflicting-pair,Hard,False
3784,Longest Common Prefix of K Strings After Removal,longest-common-prefix-of-k-strings-after-removal,Hard,False
3783,Permutations IV,permutations-iv,Hard,False
3781,Maximize the Distance Between Points on a Square,maximize-the-distance-between-points-on-a-square,Hard,False
3775,Separate Squares II,separate-squares-ii,Hard,False
3774,Check If Digits Are Equal in String After Operations II,check-if-digits-are-equal-in-string-after-operations-ii,Hard,False
3770,Lexicographically Smallest Generated String,lexicographically-smallest-generated-string,Hard,False
3762,Maximize the Minimum Game Score,maximize-the-minimum-game-score,Hard,False
3761,Maximum Difference Between Even and Odd Frequency II,maximum-difference-between-even-and-odd-frequency-ii,Hard,False
3744,Minimum Operations to Make Array Elements Zero,minimum-operations-to-make-array-elements-zero,Hard,False
3739,Manhattan Distances of All Arrangements of Pieces,manhattan-distances-of-all-arrangements-of-pieces,Hard,False
3733,Length of Longest V-Shaped Diagonal Segment,length-of-longest-v-shaped-diagonal-segment,Hard,False
3725,Maximum and Minimum Sums of at Most Size K Subarrays,maximum-and-minimum-sums-of-at-most-size-k-subarrays,Hard,False
3713,Frequencies of Shortest Supersequences,frequencies-of-shortest-supersequences,Hard,False
3711,First Letter Capitalization II,first-letter-capitalization-ii,Hard,False
3706,Smallest Substring With Identical Characters II,smallest-substring-with-identical-characters-ii,Hard,False
3701,Minimum Cost Good Caption,minimum-cost-good-caption,Hard,False
3700,Subsequences with a Unique Middle Mode I,subsequences-with-a-unique-middle-mode-i,Hard,False
3697,Minimum Increments for Target Multiples in an Array,minimum-increments-for-target-multiples-in-an-array,Hard,False
3696,Count Substrings Divisible By Last Digit,count-substrings-divisible-by-last-digit,Hard,False
3692,Shortest Matching Substring,shortest-matching-substring,Hard,False
3690,Smallest Substring With Identical Characters I,smallest-substring-with-identical-characters-i,Hard,False
3689,Maximum Area Rectangle With Point Constraints II,maximum-area-rectangle-with-point-constraints-ii,Hard,False
3688,Maximize Subarray Sum After Removing All Occurrences of One Element,maximize-subarray-sum-after-removing-all-occurrences-of-one-element,Hard,False
3687,Longest Special Path,longest-special-path,Hard,False
3682,Count the Number of Arrays with K Matching Adjacent Elements,count-the-number-of-arrays-with-k-matching-adjacent-elements,Hard,False
3680,Count Connected Components in LCM Graph,count-connected-components-in-lcm-graph,Hard,False
3675,Maximize Sum of Weights after Edge Removals,maximize-sum-of-weights-after-edge-removals,Hard,False
3674,Count Non-Decreasing Subarrays After K Operations,count-non-decreasing-subarrays-after-k-operations,Hard,False
3658,Minimize the Maximum Adjacent Element Difference,minimize-the-maximum-adjacent-element-difference,Hard,False
3648,Find the Maximum Number of Fruits Collected,find-the-maximum-number-of-fruits-collected,Hard,False
3646,Sum of Good Subsequences,sum-of-good-subsequences,Hard,False
3645,Maximize the Number of Target Nodes After Connecting Trees II,maximize-the-number-of-target-nodes-after-connecting-trees-ii,Hard,False
3640,Maximum Frequency of an Element After Performing Operations II,maximum-frequency-of-an-element-after-performing-operations-ii,Hard,False
3638,Minimum Operations to Make Character Frequencies Equal,minimum-operations-to-make-character-frequencies-equal,Hard,False
3637,Count Number of Balanced Permutations,count-number-of-balanced-permutations,Hard,False
3635,Smallest Divisible Digit Product II,smallest-divisible-digit-product-ii,Hard,False
3631,Count K-Reducible Numbers Less Than N,count-k-reducible-numbers-less-than-n,Hard,False
3630,Total Characters in String After Transformations II,total-characters-in-string-after-transformations-ii,Hard,False
3618,Find the Original Typed String II,find-the-original-typed-string-ii,Hard,False
3608,Find the Number of Subsequences With Equal GCD,find-the-number-of-subsequences-with-equal-gcd,Hard,False
3604,Find the Number of Possible Ways for an Event,find-the-number-of-possible-ways-for-an-event,Hard,False
3603,Check if DFS Strings Are Palindromes,check-if-dfs-strings-are-palindromes,Hard,False
3601,Find the K-th Character in String Game II,find-the-k-th-character-in-string-game-ii,Hard,False
3592,Find X-Sum of All K-Long Subarrays II,find-x-sum-of-all-k-long-subarrays-ii,Hard,False
3588,Count The Number of Winning Sequences,count-the-number-of-winning-sequences,Hard,False
3583,Sorted GCD Pair Queries,sorted-gcd-pair-queries,Hard,False
3580,Find the Occurrence of First Almost Equal Substring,find-the-occurrence-of-first-almost-equal-substring,Hard,False
3578,Construct 2D Grid Matching Graph Layout,construct-2d-grid-matching-graph-layout,Hard,False
3575,Find the Maximum Sequence Value of Array,find-the-maximum-sequence-value-of-array,Hard,False
3572,Count Substrings That Can Be Rearranged to Contain a String II,count-substrings-that-can-be-rearranged-to-contain-a-string-ii,Hard,False
